id,map_id,address,description,pic,link,icon,lat,lng,anim,title,infoopen,category,approved,retina,type,did,sticky,other_data,layergroup,Custom Field: GIS_ID,Custom Field: DESCRIPTION_BIKE,Custom Field: ASSET_CLASS,Custom Field: ASSET_TYPE,Custom Field: MODEL_NO,Custom Field: MODEL_DESCR,Custom Field: DIVISION,Custom Field: COMPANY,Custom Field: CONDITION_RATING,Custom Field: EVALUATION_DATE,Custom Field: EASTING,Custom Field: NORTHING,Custom Field: UploadDate
1545517,21,"-37.803263807550344, 144.9502842330201","Queensberry Street between Leveson Street and Errol Street approximately 13m West of 509-511 Queensberry Street, North Melbourne, 3051",,,,-37.80326381,144.9502842330201,,,0,Bicycle Rails,1,1,,,,,,1545517,Bicycle Rails - Stainless Steel Bicycle Hoop,Outdoor Furniture,Bicycle Rails,200101-004,Bicycle Rails - Stainless Steel Bicycle Hoop,Infrastructure and Assets,City of Melbourne,3.14,30/4/2021,319551.07,5814033.99,14/8/2021
1552643,21,"-37.800808516141274, 144.94598406360333","Abbotsford Street between Baillie Street and Arden Street approximately 28m North of 6 Mawby Lane, North Melbourne, 3051",,,,-37.80080852,144.94598406360333,,,0,Bicycle Rails,1,1,,,,,,1552643,Bicycle Rails - Stainless Steel Bicycle Hoop,Outdoor Furniture,Bicycle Rails,200101-004,Bicycle Rails - Stainless Steel Bicycle Hoop,Infrastructure and Assets,City of Melbourne,3.05,30/4/2021,319166.47,5814298.13,14/8/2021
1566047,21,"-37.805304820611056, 144.95813427565542","O'Connell Street between Victoria Street and Queensberry Street approximately 16m NE of O'Connell Residence, 15-19 O'Connell Street, North Melbourne, 3051",,,,-37.80530482,144.95813427565542,,,0,Bicycle Rails,1,1,,,,,,1566047,Bicycle Rails - Galvanised Steel Bicycle Rail,Outdoor Furniture,Bicycle Rails,200101-002,Bicycle Rails - Galvanised Steel Bicycle Rail,Infrastructure and Assets,City of Melbourne,2.2,30/4/2021,320247.18,5813822.64,14/8/2021
1566046,21,"-37.804975947262875, 144.957981595674","O'Connell Street between Victoria Street and Queensberry Street approximately 18m East of Animals Australia Federation, 37 O'Connell Street, North Melbourne, 3051",,,,-37.80497595,144.9579816,,,0,Bicycle Rails,1,1,,,,,,1566046,Bicycle Rails - Galvanised Steel Bicycle Rail,Outdoor Furniture,Bicycle Rails,200101-002,Bicycle Rails - Galvanised Steel Bicycle Rail,Infrastructure and Assets,City of Melbourne,2.2,30/4/2021,320232.94,5813858.84,14/8/2021
1569897,21,"-37.801827129687126, 144.9460986075991","Provost Street between Curzon Street and Abbotsford Street approximately 4m South of 66 Provost Street, North Melbourne, 3051",,,,-37.80182713,144.9460986075991,,,0,Bicycle Rails,1,1,,,,,,1569897,Bicycle Rails - Galvanised Steel Bicycle Rail,Outdoor Furniture,Bicycle Rails,200101-002,Bicycle Rails - Galvanised Steel Bicycle Rail,Infrastructure and Assets,City of Melbourne,2.25,30/4/2021,319179.04,5814185.32,14/8/2021
1639808,21,"-37.805888813521356, 144.95698259893246","Victoria Street between Cobden Street and Peel Street approximately 10m SE of 284 Victoria Street, North Melbourne, 3051",,,,-37.80588881,144.95698259893246,,,0,Bicycle Rails,1,1,,,,,,1639808,Bicycle Rails - Stainless Steel Bicycle Hoop,Outdoor Furniture,Bicycle Rails,200101-004,Bicycle Rails - Stainless Steel Bicycle Hoop,Infrastructure and Assets,City of Melbourne,3.16,30/4/2021,320147.2,5813755.62,14/8/2021
1533577,21,"-37.802949104956895, 144.9443278643303","Little Dryburgh Street South from Lothian Street approximately 7m NW of 43 Lothian Street, North Melbourne, 3051",,,,-37.8029491,144.9443278643303,,,0,Bicycle Rails,1,1,,,,,,1533577,Bicycle Rails - Galvanised Steel Bicycle Rail,Outdoor Furniture,Bicycle Rails,200101-002,Bicycle Rails - Galvanised Steel Bicycle Rail,Infrastructure and Assets,City of Melbourne,2.45,30/4/2021,319025.87,5814057.39,14/8/2021
1551703,21,"-37.79489527643575, 144.9398191267098","Caytre Crescent between Buncle Street and Pampas Street approximately 9m SE of 2 Caytre Crescent, North Melbourne, 3051",,,,-37.79489528,144.9398191267098,,,0,Bicycle Rails,1,1,,,,,,1551703,Bicycle Rails - Galvanised Steel Bicycle Rail,Outdoor Furniture,Bicycle Rails,200101-002,Bicycle Rails - Galvanised Steel Bicycle Rail,Infrastructure and Assets,City of Melbourne,2.23,30/4/2021,318609.19,5814942.35,14/8/2021
1618908,21,"-37.79449638809955, 144.9423432666479","Erskine Street between Dryburgh Street and Melrose Street approximately 7m SW of 86 Erskine Street, North Melbourne, 3051",,,,-37.79449639,144.9423432666479,,,0,Bicycle Rails,1,1,,,,,,1618908,Bicycle Rails - Stainless Steel Bicycle Hoop,Outdoor Furniture,Bicycle Rails,200101-004,Bicycle Rails - Stainless Steel Bicycle Hoop,Infrastructure and Assets,City of Melbourne,1.0,30/4/2021,318830.48,5814991.51,14/8/2021
1618910,21,"-37.79464007800042, 144.94207751406842","Erskine Street between Dryburgh Street and Melrose Street approximately 9m NE of Mr Gonzo, Ground, 28 Melrose Street, North Melbourne, 3051",,,,-37.79464008,144.94207751406842,,,0,Bicycle Rails,1,1,,,,,,1618910,Bicycle Rails - Stainless Steel Bicycle Hoop,Outdoor Furniture,Bicycle Rails,200101-004,Bicycle Rails - Stainless Steel Bicycle Hoop,Infrastructure and Assets,City of Melbourne,2.41,30/4/2021,318807.43,5814975.05,14/8/2021
1755839,21,"-37.80178231220389, 144.95392416961622","Courtney Street between Blackwood Street and Wreckyn Street approximately 3m SW of Metropolitan Hotel, Metropolitan Hotel, 42 Courtney Street, North Melbourne, 3051",,,,-37.80178231,144.95392416961622,,,0,Bicycle Rails,1,1,,,,,,1755839,Bicycle Rails - Stainless Steel Bicycle Hoop,Outdoor Furniture,Bicycle Rails,200101-004,Bicycle Rails - Stainless Steel Bicycle Hoop,Infrastructure and Assets,City of Melbourne,4.59,30/4/2021,319867.95,5814205.41,14/8/2021
1546791,21,"-37.79954789068514, 144.95078082968877","Errol Street Reserve approximately 27m NW of Hotham, 103 Courtney Street, North Melbourne, 3051",,,,-37.79954789,144.95078082968877,,,0,Bicycle Rails,1,1,,,,,,1546791,Bicycle Rails - Unspecified,Outdoor Furniture,Bicycle Rails,200101-000,,Parks and City Greening,City of Melbourne,4.0,19/9/2019,319585.75,5814447.29,14/8/2021
1551698,21,"-37.794969747242696, 144.93957380216327","Caytre Crescent between Buncle Street and Pampas Street approximately 5m NW of 9 Caytre Crescent, North Melbourne, 3051",,,,-37.79496975,144.93957380216327,,,0,Bicycle Rails,1,1,,,,,,1551698,Bicycle Rails - Galvanised Steel Bicycle Rail,Outdoor Furniture,Bicycle Rails,200101-002,Bicycle Rails - Galvanised Steel Bicycle Rail,Infrastructure and Assets,City of Melbourne,2.23,30/4/2021,318587.77,5814933.61,14/8/2021
1313638,21,"-37.80532916014103, 144.95202159013567","Victoria Street between Chetwynd Street and Leveson Street approximately 4m South of Heartland Records, Ground, 420 Victoria Street, North Melbourne, 3051",,,,-37.80532916,144.95202159013567,,,0,Bicycle Rails,1,1,,,,,,1313638,Bicycle Rails - Stainless Steel Bicycle Hoop,Outdoor Furniture,Bicycle Rails,200101-004,Bicycle Rails - Stainless Steel Bicycle Hoop,Infrastructure and Assets,City of Melbourne,3.03,30/4/2021,319709.06,5813808.16,14/8/2021
1378369,21,"-37.801126995232714, 144.95650983215845","Flemington Road between Elizabeth Street and Blackwood Street approximately 11m North of 1 Flemington Road, North Melbourne, 3051",,,,-37.801127,144.95650983215845,,,0,Bicycle Rails,1,1,,,,,,1378369,Bicycle Rails - Stainless Steel Bicycle Hoop,Outdoor Furniture,Bicycle Rails,200101-004,Bicycle Rails - Stainless Steel Bicycle Hoop,Infrastructure and Assets,City of Melbourne,3.0,30/4/2021,320094.02,5814283.11,14/8/2021
1313543,21,"-37.80523248023581, 144.95117808499128","Victoria Street between Chetwynd Street and Leveson Street approximately 3m South of North Melbourne Family Medical Centre, Ground, 452 Victoria Street, North Melbourne, 3051",,,,-37.80523248,144.95117808499128,,,0,Bicycle Rails,1,1,,,,,,1313543,Bicycle Rails - Stainless Steel Bicycle Hoop,Outdoor Furniture,Bicycle Rails,200101-004,Bicycle Rails - Stainless Steel Bicycle Hoop,Infrastructure and Assets,City of Melbourne,3.03,30/4/2021,319634.56,5813817.26,14/8/2021
1617598,21,"-37.7996706971808, 144.94856414210085","Curzon Street between O'Shanassy Street and Harris Street approximately 28m West of 142 Curzon Street, North Melbourne, 3051",,,,-37.7996707,144.94856414210085,,,0,Bicycle Rails,1,1,,,,,,1617598,Bicycle Rails - Stainless Steel Bicycle Hoop,Outdoor Furniture,Bicycle Rails,200101-004,Bicycle Rails - Stainless Steel Bicycle Hoop,Infrastructure and Assets,City of Melbourne,2.83,30/4/2021,319390.87,5814429.38,14/8/2021
1584856,21,"-37.800668105473186, 144.9481599350945","Arden Street between Curzon Street and Abbotsford Street approximately 28m North of 77 Arden Street, North Melbourne, 3051",,,,-37.80066811,144.9481599350945,,,0,Bicycle Rails,1,1,,,,,,1584856,Bicycle Rails - Stainless Steel Bicycle Hoop,Outdoor Furniture,Bicycle Rails,200101-004,Bicycle Rails - Stainless Steel Bicycle Hoop,Infrastructure and Assets,City of Melbourne,3.09,30/4/2021,319357.71,5814317.92,14/8/2021
1569891,21,"-37.801883178872764, 144.94653761403137","Provost Street between Curzon Street and Abbotsford Street approximately 5m SW of 48 Provost Street, North Melbourne, 3051",,,,-37.80188318,144.94653761403137,,,0,Bicycle Rails,1,1,,,,,,1569891,Bicycle Rails - Galvanised Steel Bicycle Rail,Outdoor Furniture,Bicycle Rails,200101-002,Bicycle Rails - Galvanised Steel Bicycle Rail,Infrastructure and Assets,City of Melbourne,2.25,30/4/2021,319217.83,5814179.95,14/8/2021
1569875,21,"-37.802123011532046, 144.94778518919523","Provost Street between Curzon Street and Abbotsford Street approximately 7m NW of 1-3 Provost Street, North Melbourne, 3051",,,,-37.80212301,144.94778518919523,,,0,Bicycle Rails,1,1,,,,,,1569875,Bicycle Rails - Galvanised Steel Bicycle Rail,Outdoor Furniture,Bicycle Rails,200101-002,Bicycle Rails - Galvanised Steel Bicycle Rail,Infrastructure and Assets,City of Melbourne,2.25,30/4/2021,319328.26,5814155.75,14/8/2021
1580836,21,"-37.7953295557254, 144.94247914000968","Kipling Street between Canning Street and Erskine Street approximately 3m SW of 8 Kipling Street, North Melbourne, 3051",,,,-37.79532956,144.94247914000968,,,0,Bicycle Rails,1,1,,,,,,1580836,Bicycle Rails - Galvanised Steel Bicycle Rail,Outdoor Furniture,Bicycle Rails,200101-002,Bicycle Rails - Galvanised Steel Bicycle Rail,Infrastructure and Assets,City of Melbourne,2.42,30/4/2021,318844.48,5814899.32,14/8/2021
1755818,21,"-37.80556071255438, 144.95623575806783","Peel Street between Victoria Street and Princess Street approximately 10m SW of Ground, 110 Peel Street, North Melbourne, 3051",,,,-37.80556071,144.95623575806783,,,0,Bicycle Rails,1,1,,,,,,1755818,Bicycle Rails - Stainless Steel Bicycle Hoop,Outdoor Furniture,Bicycle Rails,200101-004,Bicycle Rails - Stainless Steel Bicycle Hoop,Infrastructure and Assets,City of Melbourne,4.59,30/4/2021,320080.65,5813790.59,14/8/2021
1785427,21,"-37.80352091145264, 144.943533659347","Dryburgh Street between Victoria Street and Queensberry Street approximately 5m NW of Lucy Guerin Association Inc, 130 Dryburgh Street, North Melbourne, 3051",,,,-37.80352091,144.9435337,,,0,Bicycle Rails,1,1,,,,,,1785427,Bicycle Rails - Stainless Steel Bicycle Hoop,Outdoor Furniture,Bicycle Rails,200101-004,Bicycle Rails - Stainless Steel Bicycle Hoop,Infrastructure and Assets,City of Melbourne,5.0,30/4/2021,318957.34,5813992.4,14/8/2021
1584042,21,"-37.79943502261597, 144.94068401887324","North Melbourne Recreation Reserve approximately 72m North of Champion Parts, 205-213 Arden Street, North Melbourne, 3051",,,,-37.79943502,144.94068401887324,,,0,Bicycle Rails,1,1,,,,,,1584042,Bicycle Rails - Stainless Steel Bicycle Hoop - North Melbourne Recreation Reserve,Outdoor Furniture,Bicycle Rails,200101-004,Bicycle Rails - Stainless Steel Bicycle Hoop,Parks and City Greening,City of Melbourne,4.0,9/4/2019,318696.45,5814440.27,14/8/2021
1785443,21,"-37.798564791453096, 144.95328338164603","Flemington Road between Villiers Street and Harcourt Street approximately 6m NE of Fitin2it Personal Training, 85 Flemington Road, North Melbourne, 3051",,,,-37.79856479,144.95328338164603,,,0,Bicycle Rails,1,1,,,,,,1785443,Bicycle Rails - Stainless Steel Bicycle Hoop,Outdoor Furniture,Bicycle Rails,200101-004,Bicycle Rails - Stainless Steel Bicycle Hoop,Infrastructure and Assets,City of Melbourne,5.0,30/4/2021,319803.71,5814561.21,14/8/2021
1755829,21,"-37.8036942663128, 144.952665313141","Chetwynd Street between Victoria Street and Queensberry Street approximately 2m West of Peter Jones Special Events, 172-174 Chetwynd Street, North Melbourne, 3051",,,,-37.80369427,144.9526653,,,0,Bicycle Rails,1,1,,,,,,1755829,Bicycle Rails - Stainless Steel Bicycle Hoop,Outdoor Furniture,Bicycle Rails,200101-004,Bicycle Rails - Stainless Steel Bicycle Hoop,Infrastructure and Assets,City of Melbourne,4.59,30/4/2021,319761.76,5813990.82,14/8/2021
1378376,21,"-37.80255510562702, 144.9495688732055","Errol Street between Queensberry Street and Arden Street approximately 2m East of Stranger Than Paradise Gifts, 101 Errol Street, North Melbourne, 3051",,,,-37.80255511,144.9495688732055,,,0,Bicycle Rails,1,1,,,,,,1378376,Bicycle Rails - Stainless Steel Bicycle Hoop,Outdoor Furniture,Bicycle Rails,200101-004,Bicycle Rails - Stainless Steel Bicycle Hoop,Infrastructure and Assets,City of Melbourne,3.04,30/4/2021,319486.36,5814111.25,14/8/2021
1550797,21,"-37.80114062963416, 144.95652694683818","Flemington Road between Elizabeth Street and Blackwood Street approximately 10m North of 1 Flemington Road, North Melbourne, 3051",,,,-37.80114063,144.95652694683818,,,0,Bicycle Rails,1,1,,,,,,1550797,Bicycle Rails - Stainless Steel Bicycle Hoop,Outdoor Furniture,Bicycle Rails,200101-004,Bicycle Rails - Stainless Steel Bicycle Hoop,Infrastructure and Assets,City of Melbourne,3.0,30/4/2021,320095.56,5814281.63,14/8/2021
1580839,21,"-37.795685411871396, 144.94240589669377","Kipling Street between Canning Street and Erskine Street approximately 9m NW of 44 Canning Street, North Melbourne, 3051",,,,-37.79568541,144.94240589669377,,,0,Bicycle Rails,1,1,,,,,,1580839,Bicycle Rails - Galvanised Steel Bicycle Rail,Outdoor Furniture,Bicycle Rails,200101-002,Bicycle Rails - Galvanised Steel Bicycle Rail,Infrastructure and Assets,City of Melbourne,2.42,30/4/2021,318838.9,5814859.69,14/8/2021
1073862,21,"-37.8056151295051, 144.9545948247277","Victoria Street between Capel Street and Howard Street approximately 3m SW of Mini Hair, 344 Victoria Street, North Melbourne, 3051",,,,-37.80561513,144.9545948247277,,,0,Bicycle Rails,1,1,,,,,,1073862,Bicycle Rails - Stainless Steel Bicycle Hoop,Outdoor Furniture,Bicycle Rails,200101-004,Bicycle Rails - Stainless Steel Bicycle Hoop,Infrastructure and Assets,City of Melbourne,3.03,30/4/2021,319936.31,5813781.39,14/8/2021
1378368,21,"-37.80111999000233, 144.95650082570558","Flemington Road between Elizabeth Street and Blackwood Street approximately 12m North of 1 Flemington Road, North Melbourne, 3051",,,,-37.80111999,144.95650082570558,,,0,Bicycle Rails,1,1,,,,,,1378368,Bicycle Rails - Stainless Steel Bicycle Hoop,Outdoor Furniture,Bicycle Rails,200101-004,Bicycle Rails - Stainless Steel Bicycle Hoop,Infrastructure and Assets,City of Melbourne,3.0,30/4/2021,320093.21,5814283.87,14/8/2021
1074315,21,"-37.805387953848346, 144.95255231969134","Victoria Street between Howard Street and Chetwynd Street approximately 3m South of City Peugeot, 406-416 Victoria Street, North Melbourne, 3051",,,,-37.80538795,144.95255231969134,,,0,Bicycle Rails,1,1,,,,,,1074315,Bicycle Rails - Stainless Steel Bicycle Hoop,Outdoor Furniture,Bicycle Rails,200101-004,Bicycle Rails - Stainless Steel Bicycle Hoop,Infrastructure and Assets,City of Melbourne,3.03,30/4/2021,319755.93,5813802.66,14/8/2021
1584046,21,"-37.79933202939001, 144.9405970443934","North Melbourne Recreation Reserve approximately 83m North of Champion Parts, 205-213 Arden Street, North Melbourne, 3051",,,,-37.79933203,144.9405970443934,,,0,Bicycle Rails,1,1,,,,,,1584046,Bicycle Rails - Stainless Steel Bicycle Hoop - North Melbourne Recreation Reserve,Outdoor Furniture,Bicycle Rails,200101-004,Bicycle Rails - Stainless Steel Bicycle Hoop,Parks and City Greening,City of Melbourne,4.0,9/4/2019,318688.54,5814451.53,14/8/2021
1313639,21,"-37.805326335226724, 144.95199906559287","Victoria Street between Chetwynd Street and Leveson Street approximately 4m SW of Heartland Records, Ground, 420 Victoria Street, North Melbourne, 3051",,,,-37.80532634,144.95199906559287,,,0,Bicycle Rails,1,1,,,,,,1313639,Bicycle Rails - Stainless Steel Bicycle Hoop,Outdoor Furniture,Bicycle Rails,200101-004,Bicycle Rails - Stainless Steel Bicycle Hoop,Infrastructure and Assets,City of Melbourne,3.03,30/4/2021,319707.07,5813808.43,14/8/2021
1545554,21,"-37.80176088897744, 144.9542938809104","Blackwood Street between Flemington Road and Courtney Street approximately 31m East of Metropolitan Hotel, Metropolitan Hotel, 42 Courtney Street, North Melbourne, 3051",,,,-37.80176089,144.9542938809104,,,0,Bicycle Rails,1,1,,,,,,1545554,Bicycle Rails - Stainless Steel Bicycle Hoop,Outdoor Furniture,Bicycle Rails,200101-004,Bicycle Rails - Stainless Steel Bicycle Hoop,Infrastructure and Assets,City of Melbourne,3.12,30/4/2021,319900.45,5814208.5,14/8/2021
1558679,21,"-37.79071054469811, 144.94262159121885","Melrose Street between Alfred Street and Flemington Road approximately 7m SE of 181 Melrose Street, North Melbourne, 3051",,,,-37.79071054,144.94262159121885,,,0,Bicycle Rails,1,1,,,,,,1558679,Bicycle Rails - Galvanised Steel Bicycle Rail,Outdoor Furniture,Bicycle Rails,200101-002,Bicycle Rails - Galvanised Steel Bicycle Rail,Infrastructure and Assets,City of Melbourne,2.41,30/4/2021,318845.74,5815412.15,14/8/2021
1551688,21,"-37.79444547082518, 144.93946719603403","Caytre Crescent between Buncle Street and Pampas Street approximately 3m SE of 31 Caytre Crescent, North Melbourne, 3051",,,,-37.79444547,144.93946719603403,,,0,Bicycle Rails,1,1,,,,,,1551688,Bicycle Rails - Galvanised Steel Bicycle Rail,Outdoor Furniture,Bicycle Rails,200101-002,Bicycle Rails - Galvanised Steel Bicycle Rail,Infrastructure and Assets,City of Melbourne,2.23,30/4/2021,318577.1,5814991.58,14/8/2021
1647833,21,"-37.798036963322154, 144.95122019419782","Murphy Street between Flemington Road and Errol Street approximately 23m South of 1 Murphy Street, North Melbourne, 3051",,,,-37.79803696,144.95122019419782,,,0,Bicycle Rails,1,1,,,,,,1647833,Bicycle Rails - Stainless Steel Bicycle Hoop,Outdoor Furniture,Bicycle Rails,200101-004,Bicycle Rails - Stainless Steel Bicycle Hoop,Infrastructure and Assets,City of Melbourne,3.13,30/4/2021,319620.76,5814615.8,14/8/2021
1647826,21,"-37.798755499789614, 144.95172435582492","Harcourt Street between Courtney Street and Flemington Road approximately 27m NW of 66 Harcourt Street, North Melbourne, 3051",,,,-37.7987555,144.95172435582492,,,0,Bicycle Rails,1,1,,,,,,1647826,Bicycle Rails - Stainless Steel Bicycle Hoop,Outdoor Furniture,Bicycle Rails,200101-004,Bicycle Rails - Stainless Steel Bicycle Hoop,Infrastructure and Assets,City of Melbourne,3.13,30/4/2021,319666.9,5814537.04,14/8/2021
1580853,21,"-37.794965768399095, 144.94253170666906","Kipling Street between Canning Street and Erskine Street approximately 3m SW of 26 Kipling Street, North Melbourne, 3051",,,,-37.79496577,144.94253170666906,,,0,Bicycle Rails,1,1,,,,,,1580853,Bicycle Rails - Galvanised Steel Bicycle Rail,Outdoor Furniture,Bicycle Rails,200101-002,Bicycle Rails - Galvanised Steel Bicycle Rail,Infrastructure and Assets,City of Melbourne,2.42,30/4/2021,318848.22,5814939.79,14/8/2021
1755836,21,"-37.80134135213062, 144.95481563477557","Blackwood Street between Flemington Road and Courtney Street approximately 3m East of Port Phillip Sea Pilots Pty Ltd, 9-11 Blackwood Street, North Melbourne, 3051",,,,-37.80134135,144.95481563477557,,,0,Bicycle Rails,1,1,,,,,,1755836,Bicycle Rails - Stainless Steel Bicycle Hoop,Outdoor Furniture,Bicycle Rails,200101-004,Bicycle Rails - Stainless Steel Bicycle Hoop,Infrastructure and Assets,City of Melbourne,4.59,30/4/2021,319945.37,5814256.06,14/8/2021
1551650,21,"-37.7938590171944, 144.94028808476102","North Melbourne Community Centre approximately 6m NW of 31 Mark Street, North Melbourne, 3051",,,,-37.79385902,144.94028808476102,,,0,Bicycle Rails,1,1,,,,,,1551650,Bicycle Rails - Galvanised Steel Bicycle Rail,Outdoor Furniture,Bicycle Rails,200101-002,Bicycle Rails - Galvanised Steel Bicycle Rail,Infrastructure and Assets,City of Melbourne,2.23,30/4/2021,318647.95,5815058.25,14/8/2021
1551705,21,"-37.795004867894555, 144.93991749548397","Caytre Crescent between Buncle Street and Pampas Street approximately 5m NW of 1 Caytre Crescent, North Melbourne, 3051",,,,-37.79500487,144.93991749548397,,,0,Bicycle Rails,1,1,,,,,,1551705,Bicycle Rails - Galvanised Steel Bicycle Rail,Outdoor Furniture,Bicycle Rails,200101-002,Bicycle Rails - Galvanised Steel Bicycle Rail,Infrastructure and Assets,City of Melbourne,2.23,30/4/2021,318618.12,5814930.38,14/8/2021
1785428,21,"-37.803548418529886, 144.94352971612687","Dryburgh Street between Victoria Street and Queensberry Street approximately 3m NW of Lucy Guerin Association Inc, 130 Dryburgh Street, North Melbourne, 3051",,,,-37.80354842,144.94352971612687,,,0,Bicycle Rails,1,1,,,,,,1785428,Bicycle Rails - Stainless Steel Bicycle Hoop,Outdoor Furniture,Bicycle Rails,200101-004,Bicycle Rails - Stainless Steel Bicycle Hoop,Infrastructure and Assets,City of Melbourne,5.0,30/4/2021,318957.06,5813989.34,14/8/2021
1073863,21,"-37.80561832147936, 144.95461256892224","Victoria Street between Capel Street and Howard Street approximately 3m South of Mini Hair, 344 Victoria Street, North Melbourne, 3051",,,,-37.80561832,144.95461256892224,,,0,Bicycle Rails,1,1,,,,,,1073863,Bicycle Rails - Stainless Steel Bicycle Hoop,Outdoor Furniture,Bicycle Rails,200101-004,Bicycle Rails - Stainless Steel Bicycle Hoop,Infrastructure and Assets,City of Melbourne,3.03,30/4/2021,319937.88,5813781.07,14/8/2021
1551710,21,"-37.79442053642203, 144.94078261810634","Pampas Street from Buncle Street approximately 4m SE of 8 Pampas Street, North Melbourne, 3051",,,,-37.79442054,144.94078261810634,,,0,Bicycle Rails,1,1,,,,,,1551710,Bicycle Rails - Galvanised Steel Bicycle Rail,Outdoor Furniture,Bicycle Rails,200101-002,Bicycle Rails - Galvanised Steel Bicycle Rail,Infrastructure and Assets,City of Melbourne,2.23,30/4/2021,318692.87,5814996.9,14/8/2021
1545553,21,"-37.80182761239233, 144.95397436913973","Courtney Street between Blackwood Street and Wreckyn Street approximately 8m SE of Metropolitan Hotel, Metropolitan Hotel, 42 Courtney Street, North Melbourne, 3051",,,,-37.80182761,144.95397436913973,,,0,Bicycle Rails,1,1,,,,,,1545553,Bicycle Rails - Stainless Steel Bicycle Hoop,Outdoor Furniture,Bicycle Rails,200101-004,Bicycle Rails - Stainless Steel Bicycle Hoop,Infrastructure and Assets,City of Melbourne,3.12,30/4/2021,319872.48,5814200.48,14/8/2021
1609830,21,"-37.80112231472673, 144.95133903132017","Intersection of Arden Street and Leveson Street approximately 17m NE of 23 Arden Street, North Melbourne, 3051",,,,-37.80112231,144.95133903132017,,,0,Bicycle Rails,1,1,,,,,,1609830,Bicycle Rails - Painted Steel Bicycle Rail,Outdoor Furniture,Bicycle Rails,200101-003,Bicycle Rails - Painted Steel Bicycle Rail,Infrastructure and Assets,City of Melbourne,3.14,30/4/2021,319638.73,5814273.66,14/8/2021
1569888,21,"-37.80201362948012, 144.9467214007067","Provost Street between Curzon Street and Abbotsford Street approximately 3m North of 35 Provost Street, North Melbourne, 3051",,,,-37.80201363,144.9467214007067,,,0,Bicycle Rails,1,1,,,,,,1569888,Bicycle Rails - Galvanised Steel Bicycle Rail,Outdoor Furniture,Bicycle Rails,200101-002,Bicycle Rails - Galvanised Steel Bicycle Rail,Infrastructure and Assets,City of Melbourne,2.25,30/4/2021,319234.33,5814165.83,14/8/2021
1533580,21,"-37.80410058610889, 144.94412942819133","Little Dryburgh Street South from Lothian Street approximately 7m SW of 15 Lothian Street, North Melbourne, 3051",,,,-37.80410059,144.94412942819133,,,0,Bicycle Rails,1,1,,,,,,1533580,Bicycle Rails - Galvanised Steel Bicycle Rail,Outdoor Furniture,Bicycle Rails,200101-002,Bicycle Rails - Galvanised Steel Bicycle Rail,Infrastructure and Assets,City of Melbourne,2.45,30/4/2021,319011.21,5813929.23,14/8/2021
1772399,21,"-37.80475267930841, 144.94768399801978","Curzon Street between Victoria Street and Elm Street approximately 27m West of Brown Gouge Valet, 2-4 Curzon Street, North Melbourne, 3051",,,,-37.80475268,144.94768399801978,,,0,Bicycle Rails,1,1,,,,,,1772399,Bicycle Rails - Stainless Steel Bicycle Hoop,Outdoor Furniture,Bicycle Rails,200101-004,Bicycle Rails - Stainless Steel Bicycle Hoop,Infrastructure and Assets,City of Melbourne,4.59,30/4/2021,319325.76,5813863.75,14/8/2021
1519386,21,"-37.80102669686558, 144.94530770462205","Little Lothian Street North from Lothian Street approximately 5m NW of 62 Little Lothian Street North, North Melbourne, 3051",,,,-37.8010267,144.94530770462205,,,0,Bicycle Rails,1,1,,,,,,1519386,Bicycle Rails - Galvanised Steel Bicycle Rail,Outdoor Furniture,Bicycle Rails,200101-002,Bicycle Rails - Galvanised Steel Bicycle Rail,Infrastructure and Assets,City of Melbourne,1.85,30/4/2021,319107.45,5814272.61,14/8/2021
1074066,21,"-37.799860136429594, 144.94320725832355","North Melbourne Recreation Centre Aquatic Centre approximately 32m West of North Melbourne Recreation Centre, Aquatic Centre, 1 Macaulay Road, North Melbourne, 3051",,,,-37.79986014,144.94320725832355,,,0,Bicycle Rails,1,1,,,,,,1074066,Bicycle Rails - Stainless Steel Bicycle Hoop,Outdoor Furniture,Bicycle Rails,200101-004,Bicycle Rails - Stainless Steel Bicycle Hoop,Infrastructure and Assets,City of Melbourne,1.17,30/4/2021,318919.66,5814397.99,14/8/2021
