id,map_id,address,description,pic,link,icon,lat,lng,anim,title,infoopen,category,approved,retina,type,did,sticky,other_data,layergroup,Custom Field: GIS_ID,Custom Field: DESCRIPTION_BIKE,Custom Field: ASSET_CLASS,Custom Field: ASSET_TYPE,Custom Field: MODEL_NO,Custom Field: MODEL_DESCR,Custom Field: DIVISION,Custom Field: COMPANY,Custom Field: CONDITION_RATING,Custom Field: EVALUATION_DATE,Custom Field: EASTING,Custom Field: NORTHING,Custom Field: UploadDate
1777907,21,"-37.80401526937129, 144.96047624214916","Leicester Street between Queensberry Street and Pelham Street approximately 7m SW of CitiPower Pty Ltd, Substation 60, 90 Leicester Street, Carlton, 3053",,,,-37.80401527,144.96047624214916,,,0,Bicycle Rails,1,1,,,,,,1777907,Bicycle Rails - Stainless Steel Bicycle Hoop,Outdoor Furniture,Bicycle Rails,200101-004,Bicycle Rails - Stainless Steel Bicycle Hoop,Infrastructure and Assets,City of Melbourne,4.59,30/4/2021,320450.25,5813970.24,14/8/2021
1557571,21,"-37.800296214072624, 144.96373168470276","Grattan Street between Swanston Street and Bouverie Street approximately 35m NE of Teaser Carlton, 163 Grattan Street, Carlton, 3053",,,,-37.80029621,144.96373168470276,,,0,Bicycle Rails,1,1,,,,,,1557571,Bicycle Rails - Stainless Steel Bicycle Hoop,Outdoor Furniture,Bicycle Rails,200101-004,Bicycle Rails - Stainless Steel Bicycle Hoop,Infrastructure and Assets,City of Melbourne,3.11,30/4/2021,320727.88,5814389.18,14/8/2021
1744267,21,"-37.80391711430742, 144.96022032354898","Leicester Street between Queensberry Street and Pelham Street approximately 21m NE of CitiPower Pty Ltd, Substation Opposite, 1 Barry Street, Carlton, 3053",,,,-37.80391711,144.96022032354898,,,0,Bicycle Rails,1,1,,,,,,1744267,Bicycle Rails - Stainless Steel Bicycle Hoop,Outdoor Furniture,Bicycle Rails,200101-004,Bicycle Rails - Stainless Steel Bicycle Hoop,Infrastructure and Assets,City of Melbourne,3.95,30/4/2021,320427.48,5813980.64,14/8/2021
1528513,21,"-37.801016768554284, 144.97292346976985","Carlton Street between Nicholson Street and Canning Street approximately 5m SW of 38 Carlton Street, Carlton, 3053",,,,-37.80101677,144.97292346976985,,,0,Bicycle Rails,1,1,,,,,,1528513,Bicycle Rails - Galvanised Steel Bicycle Rail,Outdoor Furniture,Bicycle Rails,200101-002,Bicycle Rails - Galvanised Steel Bicycle Rail,Infrastructure and Assets,City of Melbourne,2.33,30/4/2021,321538.94,5814326.82,14/8/2021
1477479,21,"-37.79513476689506, 144.97103928752776","Rathdowne Street between Pitt Street and Kay Street approximately 4m West of 180 Rathdowne Street, Carlton, 3053",,,,-37.79513477,144.97103928752776,,,0,Bicycle Rails,1,1,,,,,,1477479,Bicycle Rails - Stainless Steel Bicycle Hoop,Outdoor Furniture,Bicycle Rails,200101-004,Bicycle Rails - Stainless Steel Bicycle Hoop,Infrastructure and Assets,City of Melbourne,2.89,30/4/2021,321358.87,5814975.92,14/8/2021
1755486,21,"-37.79906328327811, 144.96732930373952","Lygon Street between Grattan Street and Faraday Street approximately 6m NW of 338 Lygon Street, Carlton, 3053",,,,-37.79906328,144.96732930373952,,,0,Bicycle Rails,1,1,,,,,,1755486,Bicycle Rails - Stainless Steel Bicycle Hoop,Outdoor Furniture,Bicycle Rails,200101-004,Bicycle Rails - Stainless Steel Bicycle Hoop,Infrastructure and Assets,City of Melbourne,4.59,30/4/2021,321041.67,5814532.89,14/8/2021
1473555,21,"-37.80323319349724, 144.9625670315702","Lincoln Square South between Swanston Street and Bouverie Street approximately 13m East of Save The Children Australia, Ground, Level 1-2 & Part Level 3, 33 Lincoln Square South, Carlton, 3053",,,,-37.80323319,144.9625670315702,,,0,Bicycle Rails,1,1,,,,,,1473555,Bicycle Rails - Stainless Steel Bicycle Hoop,Outdoor Furniture,Bicycle Rails,200101-004,Bicycle Rails - Stainless Steel Bicycle Hoop,Infrastructure and Assets,City of Melbourne,2.95,30/4/2021,320632.44,5814061.04,14/8/2021
1769543,21,"-37.796069495853345, 144.96747133260484","Palmerston Street between Lygon Street and Keppel Street approximately 30m South of 230 Palmerston Street, Carlton, 3053",,,,-37.7960695,144.96747133260484,,,0,Bicycle Rails,1,1,,,,,,1769543,Bicycle Rails - Stainless Steel Bicycle Hoop,Outdoor Furniture,Bicycle Rails,200101-004,Bicycle Rails - Stainless Steel Bicycle Hoop,Infrastructure and Assets,City of Melbourne,4.59,30/4/2021,321046.95,5814865.37,14/8/2021
1074728,21,"-37.80086681940303, 144.96723056818746","Grattan Street between Drummond Street and Lygon Street approximately 17m West of Melbourne University Regiment, 65 Grattan Street, Carlton, 3053",,,,-37.80086682,144.96723056818746,,,0,Bicycle Rails,1,1,,,,,,1074728,Bicycle Rails - Stainless Steel Bicycle Hoop,Outdoor Furniture,Bicycle Rails,200101-004,Bicycle Rails - Stainless Steel Bicycle Hoop,Infrastructure and Assets,City of Melbourne,3.11,30/4/2021,321037.33,5814332.57,14/8/2021
1313789,21,"-37.798052901097435, 144.96751316033007","Lygon Street between Faraday Street and Elgin Street approximately 19m North of Ground, 366 Lygon Street, Carlton, 3053",,,,-37.7980529,144.96751316033007,,,0,Bicycle Rails,1,1,,,,,,1313789,Bicycle Rails - Stainless Steel Bicycle Hoop,Outdoor Furniture,Bicycle Rails,200101-004,Bicycle Rails - Stainless Steel Bicycle Hoop,Infrastructure and Assets,City of Melbourne,3.17,30/4/2021,321055.42,5814645.36,14/8/2021
1755844,21,"-37.80206524654489, 144.95972906321106","Pelham Street between Leicester Street and Barry Street approximately 49m NE of University Square Student Accommodation, 85 Barry Street, Carlton, 3053",,,,-37.80206525,144.95972906321106,,,0,Bicycle Rails,1,1,,,,,,1755844,Bicycle Rails - Stainless Steel Bicycle Hoop,Outdoor Furniture,Bicycle Rails,200101-004,Bicycle Rails - Stainless Steel Bicycle Hoop,Infrastructure and Assets,City of Melbourne,4.59,30/4/2021,320379.74,5814185.19,14/8/2021
1744926,21,"-37.7983591107048, 144.96871906200096","Drummond Street between Faraday Street and Elgin Street approximately 10m NE of Masani's Italian Dining & Terrace, 313-315 Drummond Street, Carlton, 3053",,,,-37.79835911,144.96871906200096,,,0,Bicycle Rails,1,1,,,,,,1744926,Bicycle Rails - Stainless Steel Bicycle Hoop,Outdoor Furniture,Bicycle Rails,200101-004,Bicycle Rails - Stainless Steel Bicycle Hoop,Infrastructure and Assets,City of Melbourne,4.18,30/4/2021,321162.34,5814613.69,14/8/2021
1546086,21,"-37.79512458660312, 144.97158876897396","Kay Street between Canning Street and Rathdowne Street approximately 5m NE of 109 Kay Street, Carlton, 3053",,,,-37.79512459,144.97158876897396,,,0,Bicycle Rails,1,1,,,,,,1546086,Bicycle Rails - Galvanised Steel Bicycle Rail,Outdoor Furniture,Bicycle Rails,200101-002,Bicycle Rails - Galvanised Steel Bicycle Rail,Infrastructure and Assets,City of Melbourne,2.13,30/4/2021,321407.23,5814978.1,14/8/2021
1752899,21,"-37.80664158020303, 144.96452375431923","Cardigan Street between Victoria Street and Queensberry Street approximately 28m West of Royal Melbourne Institute Of Technology, 80-92 Victoria Street, Carlton, 3053",,,,-37.80664158,144.96452375431923,,,0,Bicycle Rails,1,1,,,,,,1752899,Bicycle Rails - Stainless Steel Bicycle Hoop,Outdoor Furniture,Bicycle Rails,200101-004,Bicycle Rails - Stainless Steel Bicycle Hoop,Infrastructure and Assets,City of Melbourne,4.18,30/4/2021,320812.96,5813686.58,14/8/2021
1546837,21,"-37.794841537816446, 144.9744849265172","Station Street between Kay Street and Princes Street approximately 5m West of 108 Station Street, Carlton, 3053",,,,-37.79484154,144.9744849265172,,,0,Bicycle Rails,1,1,,,,,,1546837,Bicycle Rails - Galvanised Steel Bicycle Rail,Outdoor Furniture,Bicycle Rails,200101-002,Bicycle Rails - Galvanised Steel Bicycle Rail,Infrastructure and Assets,City of Melbourne,2.5,30/4/2021,321661.57,5815015.04,14/8/2021
1769856,21,"-37.80187222276875, 144.96066081196045","University Square approximately 21m West of Former Lane, Former Lane, 174 Leicester Street, Carlton, 3053",,,,-37.80187222,144.96066081196045,,,0,Bicycle Rails,1,1,,,,,,1769856,Bicycle Rails - Stainless Steel Bicycle Hoop - University Square,Outdoor Furniture,Bicycle Rails,200101-004,Bicycle Rails - Stainless Steel Bicycle Hoop,Parks and City Greening,City of Melbourne,5.0,9/1/2019,320461.31,5814208.4,14/8/2021
1587879,21,"-37.79323691835967, 144.97143371516603","Carlton Baths approximately 18m South of Carlton Baths, 248 Rathdowne Street, Carlton, 3053",,,,-37.79323692,144.97143371516603,,,0,Bicycle Rails,1,1,,,,,,1587879,Bicycle Rails - Stainless Steel Bicycle Hoop,Outdoor Furniture,Bicycle Rails,200101-004,Bicycle Rails - Stainless Steel Bicycle Hoop,Infrastructure and Assets,City of Melbourne,1.69,30/4/2021,321389.03,5815187.27,14/8/2021
1755863,21,"-37.80418948435006, 144.96084671505523","Queensberry Street between Bouverie Street and Leicester Street approximately 7m West of Queensberry Childrens Centre, Gnd & Flr1, 224-252 Queensberry Street, Carlton, 3053",,,,-37.80418948,144.96084671505525,,,0,Bicycle Rails,1,1,,,,,,1755863,Bicycle Rails - Stainless Steel Bicycle Hoop,Outdoor Furniture,Bicycle Rails,200101-004,Bicycle Rails - Stainless Steel Bicycle Hoop,Infrastructure and Assets,City of Melbourne,4.59,30/4/2021,320483.29,5813951.62,14/8/2021
1074911,21,"-37.804799675346835, 144.96034221723923","Leicester Street between Berkeley Street and Queensberry Street approximately 35m NE of Diabetes Victoria, Ground, 51 Leicester Street, Carlton, 3053",,,,-37.80479968,144.96034221723923,,,0,Bicycle Rails,1,1,,,,,,1074911,Bicycle Rails - Stainless Steel Bicycle Hoop,Outdoor Furniture,Bicycle Rails,200101-004,Bicycle Rails - Stainless Steel Bicycle Hoop,Infrastructure and Assets,City of Melbourne,2.96,30/4/2021,320440.35,5813882.94,14/8/2021
1473548,21,"-37.79867040461957, 144.96894006102556","Drummond Street between Faraday Street and Elgin Street approximately 2m NW of CMY, 304 Drummond Street, Carlton, 3053",,,,-37.7986704,144.96894006102556,,,0,Bicycle Rails,1,1,,,,,,1473548,Bicycle Rails - Stainless Steel Bicycle Hoop,Outdoor Furniture,Bicycle Rails,200101-004,Bicycle Rails - Stainless Steel Bicycle Hoop,Infrastructure and Assets,City of Melbourne,2.91,30/4/2021,321182.55,5814579.57,14/8/2021
1378407,21,"-37.79598204358283, 144.96794435033715","Palmerston Street between Drummond Street and Lygon Street approximately 21m North of 450 Lygon Street, Carlton, 3053",,,,-37.79598204,144.96794435033715,,,0,Bicycle Rails,1,1,,,,,,1378407,Bicycle Rails - Stainless Steel Bicycle Hoop,Outdoor Furniture,Bicycle Rails,200101-004,Bicycle Rails - Stainless Steel Bicycle Hoop,Infrastructure and Assets,City of Melbourne,2.92,30/4/2021,321088.39,5814875.98,14/8/2021
1546077,21,"-37.79522868315055, 144.97263083971427","Kay Street between Canning Street and Rathdowne Street approximately 5m North of 69 Kay Street, Carlton, 3053",,,,-37.79522868,144.97263083971427,,,0,Bicycle Rails,1,1,,,,,,1546077,Bicycle Rails - Galvanised Steel Bicycle Rail,Outdoor Furniture,Bicycle Rails,200101-002,Bicycle Rails - Galvanised Steel Bicycle Rail,Infrastructure and Assets,City of Melbourne,2.13,30/4/2021,321499.24,5814968.54,14/8/2021
1546847,21,"-37.79476721706134, 144.97438168166175","Station Street between Kay Street and Princes Street approximately 6m East of 107 Station Street, Carlton, 3053",,,,-37.79476722,144.97438168166175,,,0,Bicycle Rails,1,1,,,,,,1546847,Bicycle Rails - Galvanised Steel Bicycle Rail,Outdoor Furniture,Bicycle Rails,200101-002,Bicycle Rails - Galvanised Steel Bicycle Rail,Infrastructure and Assets,City of Melbourne,2.5,30/4/2021,321652.3,5815023.09,14/8/2021
1074817,21,"-37.806767827277476, 144.9649925668913","Victoria Street between Lygon Street and Cardigan Street approximately 16m East of Royal Melbourne Institute Of Technology, 80-92 Victoria Street, Carlton, 3053",,,,-37.80676783,144.9649925668913,,,0,Bicycle Rails,1,1,,,,,,1074817,Bicycle Rails - Stainless Steel Bicycle Hoop,Outdoor Furniture,Bicycle Rails,200101-004,Bicycle Rails - Stainless Steel Bicycle Hoop,Infrastructure and Assets,City of Melbourne,3.15,30/4/2021,320854.54,5813673.47,14/8/2021
1588697,21,"-37.79554858202352, 144.9743684018212","Station Street between Palmerston Street and Kay Street approximately 5m West of 88 Station Street, Carlton, 3053",,,,-37.79554858,144.9743684018212,,,0,Bicycle Rails,1,1,,,,,,1588697,Bicycle Rails - Galvanised Steel Bicycle Rail,Outdoor Furniture,Bicycle Rails,200101-002,Bicycle Rails - Galvanised Steel Bicycle Rail,Infrastructure and Assets,City of Melbourne,2.5,30/4/2021,321653.01,5814936.36,14/8/2021
1477524,21,"-37.802209015124504, 144.96027186255665","Pelham Street between Leicester Street and Barry Street approximately 5m NW of Telstra Carlton Exchange, 183 Pelham Street, Carlton, 3053",,,,-37.80220902,144.96027186255665,,,0,Bicycle Rails,1,1,,,,,,1477524,Bicycle Rails - Stainless Steel Bicycle Hoop,Outdoor Furniture,Bicycle Rails,200101-004,Bicycle Rails - Stainless Steel Bicycle Hoop,Infrastructure and Assets,City of Melbourne,3.12,30/4/2021,320427.88,5814170.28,14/8/2021
1546103,21,"-37.795067440972446, 144.97282331225446","Kay Street between Canning Street and Rathdowne Street approximately 5m South of 62 Kay Street, Carlton, 3053",,,,-37.79506744,144.97282331225446,,,0,Bicycle Rails,1,1,,,,,,1546103,Bicycle Rails - Galvanised Steel Bicycle Rail,Outdoor Furniture,Bicycle Rails,200101-002,Bicycle Rails - Galvanised Steel Bicycle Rail,Infrastructure and Assets,City of Melbourne,2.13,30/4/2021,321515.8,5814986.8,14/8/2021
1753965,21,"-37.802391172801784, 144.96676138451198","Lygon Street between Pelham Street and Argyle Place North approximately 5m West of Players On Lygon, Ground, 200 Lygon Street, Carlton, 3053",,,,-37.80239117,144.96676138451198,,,0,Bicycle Rails,1,1,,,,,,1753965,Bicycle Rails - Stainless Steel Bicycle Hoop,Outdoor Furniture,Bicycle Rails,200101-004,Bicycle Rails - Stainless Steel Bicycle Hoop,Infrastructure and Assets,City of Melbourne,3.17,30/4/2021,320999.7,5814162.52,14/8/2021
1450099,21,"-37.80626676767658, 144.96046574963262","Victoria Street between Bouverie Street and Elizabeth Street approximately 3m SW of Shop 1, 204-208 Victoria Street, Carlton, 3053",,,,-37.80626677,144.96046574963262,,,0,Bicycle Rails,1,1,,,,,,1450099,Bicycle Rails - Stainless Steel Bicycle Hoop,Outdoor Furniture,Bicycle Rails,200101-004,Bicycle Rails - Stainless Steel Bicycle Hoop,Infrastructure and Assets,City of Melbourne,4.15,30/4/2021,320454.78,5813720.38,14/8/2021
1744273,21,"-37.8037867503861, 144.96011317131695","Barry Street between Leicester Street and Pelham Street approximately 15m East of The University of Melbourne, Ground, Part Level 1 & Level 2-3, 11 Barry Street, Carlton, 3053",,,,-37.80378675,144.96011317131695,,,0,Bicycle Rails,1,1,,,,,,1744273,Bicycle Rails - Stainless Steel Bicycle Hoop,Outdoor Furniture,Bicycle Rails,200101-004,Bicycle Rails - Stainless Steel Bicycle Hoop,Infrastructure and Assets,City of Melbourne,3.95,30/4/2021,320417.73,5813994.9,14/8/2021
1073878,21,"-37.804202326524305, 144.9609430177689","Queensberry Street between Bouverie Street and Leicester Street approximately 4m SE of Queensberry Childrens Centre, Gnd & Flr1, 224-252 Queensberry Street, Carlton, 3053",,,,-37.80420233,144.9609430177689,,,0,Bicycle Rails,1,1,,,,,,1073878,Bicycle Rails - Stainless Steel Bicycle Hoop,Outdoor Furniture,Bicycle Rails,200101-004,Bicycle Rails - Stainless Steel Bicycle Hoop,Infrastructure and Assets,City of Melbourne,3.09,30/4/2021,320491.8,5813950.38,14/8/2021
1546838,21,"-37.79496062453778, 144.97446634254462","Station Street between Kay Street and Princes Street approximately 5m West of 102 Station Street, Carlton, 3053",,,,-37.79496062,144.97446634254462,,,0,Bicycle Rails,1,1,,,,,,1546838,Bicycle Rails - Galvanised Steel Bicycle Rail,Outdoor Furniture,Bicycle Rails,200101-002,Bicycle Rails - Galvanised Steel Bicycle Rail,Infrastructure and Assets,City of Melbourne,2.5,30/4/2021,321660.22,5815001.79,14/8/2021
1723211,21,"-37.793438783706016, 144.96660006655955","Intersection of Cardigan Street and Lytton Street approximately 77m NW of 21 Lytton Street, Carlton, 3053",,,,-37.79343878,144.96660006655955,,,0,Bicycle Rails,1,1,,,,,,1723211,Bicycle Rails - Stainless Steel Bicycle Hoop,Outdoor Furniture,Bicycle Rails,200101-004,Bicycle Rails - Stainless Steel Bicycle Hoop,Infrastructure and Assets,City of Melbourne,2.95,30/4/2021,320963.88,5815155.62,14/8/2021
1074922,21,"-37.801566665315896, 144.96285463160712","Lincoln Square North between Swanston Street and Bouverie Street approximately 49m SE of Lincoln Bakery Cafe, 154 Bouverie Street, Carlton, 3053",,,,-37.80156667,144.96285463160712,,,0,Bicycle Rails,1,1,,,,,,1074922,Bicycle Rails - Stainless Steel Bicycle Hoop,Outdoor Furniture,Bicycle Rails,200101-004,Bicycle Rails - Stainless Steel Bicycle Hoop,Infrastructure and Assets,City of Melbourne,3.15,30/4/2021,320653.73,5814246.52,14/8/2021
1450100,21,"-37.806277624657675, 144.9605618824124","Victoria Street between Bouverie Street and Elizabeth Street approximately 7m SE of Shop 1, 204-208 Victoria Street, Carlton, 3053",,,,-37.80627762,144.9605618824124,,,0,Bicycle Rails,1,1,,,,,,1450100,Bicycle Rails - Stainless Steel Bicycle Hoop,Outdoor Furniture,Bicycle Rails,200101-004,Bicycle Rails - Stainless Steel Bicycle Hoop,Infrastructure and Assets,City of Melbourne,4.15,30/4/2021,320463.27,5813719.36,14/8/2021
1656136,21,"-37.79873359666307, 144.96412405616883","Swanston Street between Grattan Street and Faraday Street approximately 29m NW of Sparks Melbourne, 750 Swanston Street, Carlton, 3053",,,,-37.7987336,144.96412405616883,,,0,Bicycle Rails,1,1,,,,,,1656136,Bicycle Rails - Stainless Steel Bicycle Hoop,Outdoor Furniture,Bicycle Rails,200101-004,Bicycle Rails - Stainless Steel Bicycle Hoop,Infrastructure and Assets,City of Melbourne,3.15,30/4/2021,320758.65,5814563.33,14/8/2021
1073840,21,"-37.803383989534126, 144.96332931199981","Swanston Street between Queensberry Street and Lincoln Square South approximately 16m SE of 5 Lincoln Square South, Carlton, 3053",,,,-37.80338399,144.9633293119998,,,0,Bicycle Rails,1,1,,,,,,1073840,Bicycle Rails - Galvanised Steel Bicycle Rail,Outdoor Furniture,Bicycle Rails,200101-002,Bicycle Rails - Galvanised Steel Bicycle Rail,Infrastructure and Assets,City of Melbourne,3.15,30/4/2021,320699.92,5814045.77,14/8/2021
1755789,21,"-37.80158999391, 144.9630779610998","Lincoln Square North between Swanston Street and Bouverie Street approximately 64m South of 19-25 Church Street, Carlton, 3053",,,,-37.80158999,144.9630779610998,,,0,Bicycle Rails,1,1,,,,,,1755789,Bicycle Rails - Stainless Steel Bicycle Hoop,Outdoor Furniture,Bicycle Rails,200101-004,Bicycle Rails - Stainless Steel Bicycle Hoop,Infrastructure and Assets,City of Melbourne,4.59,30/4/2021,320673.45,5814244.36,14/8/2021
1074404,21,"-37.799673073904934, 144.9672279752329","Lygon Street between Grattan Street and Faraday Street approximately 6m NW of 310 Lygon Street, Carlton, 3053",,,,-37.79967307,144.9672279752329,,,0,Bicycle Rails,1,1,,,,,,1074404,Bicycle Rails - Stainless Steel Bicycle Hoop,Outdoor Furniture,Bicycle Rails,200101-004,Bicycle Rails - Stainless Steel Bicycle Hoop,Infrastructure and Assets,City of Melbourne,3.17,30/4/2021,321034.22,5814465.03,14/8/2021
1751502,21,"-37.798761507932866, 144.96895017191997","Faraday Street between Rathdowne Street and Drummond Street approximately 8m South of CMY, 304 Drummond Street, Carlton, 3053",,,,-37.79876151,144.96895017191997,,,0,Bicycle Rails,1,1,,,,,,1751502,Bicycle Rails - Stainless Steel Bicycle Hoop,Outdoor Furniture,Bicycle Rails,200101-004,Bicycle Rails - Stainless Steel Bicycle Hoop,Infrastructure and Assets,City of Melbourne,4.11,30/4/2021,321183.66,5814569.48,14/8/2021
1477526,21,"-37.80215455195577, 144.95975499958718","Pelham Street between Leicester Street and Barry Street approximately 48m East of 83 Barry Street, Carlton, 3053",,,,-37.80215455,144.95975499958718,,,0,Bicycle Rails,1,1,,,,,,1477526,Bicycle Rails - Stainless Steel Bicycle Hoop,Outdoor Furniture,Bicycle Rails,200101-004,Bicycle Rails - Stainless Steel Bicycle Hoop,Infrastructure and Assets,City of Melbourne,3.12,30/4/2021,320382.24,5814175.33,14/8/2021
1528490,21,"-37.79885249315714, 144.96806012074734","Faraday Street between Drummond Street and Lygon Street approximately 13m East of Museo Italiano, Gnd & Flr1, 199 Faraday Street, Carlton, 3053",,,,-37.79885249,144.96806012074734,,,0,Bicycle Rails,1,1,,,,,,1528490,Bicycle Rails - Galvanised Steel Bicycle Rail,Outdoor Furniture,Bicycle Rails,200101-002,Bicycle Rails - Galvanised Steel Bicycle Rail,Infrastructure and Assets,City of Melbourne,2.53,30/4/2021,321105.51,5814557.68,14/8/2021
1744928,21,"-37.79841491628567, 144.96870992400582","Drummond Street between Faraday Street and Elgin Street approximately 5m NE of Masani's Italian Dining & Terrace, 313-315 Drummond Street, Carlton, 3053",,,,-37.79841492,144.96870992400582,,,0,Bicycle Rails,1,1,,,,,,1744928,Bicycle Rails - Stainless Steel Bicycle Hoop,Outdoor Furniture,Bicycle Rails,200101-004,Bicycle Rails - Stainless Steel Bicycle Hoop,Infrastructure and Assets,City of Melbourne,4.18,30/4/2021,321161.67,5814607.48,14/8/2021
1074914,21,"-37.80509195266246, 144.9602864716009","Intersection of Leicester Street and Berkeley Street approximately 29m SE of Diabetes Victoria, Ground, 51 Leicester Street, Carlton, 3053",,,,-37.80509195,144.9602864716009,,,0,Bicycle Rails,1,1,,,,,,1074914,Bicycle Rails - Stainless Steel Bicycle Hoop,Outdoor Furniture,Bicycle Rails,200101-004,Bicycle Rails - Stainless Steel Bicycle Hoop,Infrastructure and Assets,City of Melbourne,2.96,30/4/2021,320436.15,5813850.4,14/8/2021
1755779,21,"-37.797590546344914, 144.96432238662575","Swanston Street between Faraday Street and Elgin Street approximately 27m West of 796 Swanston Street, Carlton, 3053",,,,-37.79759055,144.96432238662575,,,0,Bicycle Rails,1,1,,,,,,1755779,Bicycle Rails - Stainless Steel Bicycle Hoop,Outdoor Furniture,Bicycle Rails,200101-004,Bicycle Rails - Stainless Steel Bicycle Hoop,Infrastructure and Assets,City of Melbourne,4.59,30/4/2021,320773.35,5814690.55,14/8/2021
1751646,21,"-37.80277082726768, 144.96709477053403","Pelham Street between Drummond Street and Lygon Street approximately 7m SW of 66 Pelham Street, Carlton, 3053",,,,-37.80277083,144.96709477053403,,,0,Bicycle Rails,1,1,,,,,,1751646,Bicycle Rails - Stainless Steel Bicycle Hoop,Outdoor Furniture,Bicycle Rails,200101-004,Bicycle Rails - Stainless Steel Bicycle Hoop,Infrastructure and Assets,City of Melbourne,4.12,30/4/2021,321029.97,5814121.03,14/8/2021
1798312,21,"-37.79632543689979, 144.97298789284835","Canning Street between Palmerston Street and Pitt Street approximately 13m South of 113 Canning Street, Carlton, 3053",,,,-37.79632544,144.97298789284835,,,0,Bicycle Rails,1,1,,,,,,1798312,Bicycle Rails - Stainless Steel Bicycle Hoop,Outdoor Furniture,Bicycle Rails,200101-004,Bicycle Rails - Stainless Steel Bicycle Hoop,Infrastructure and Assets,City of Melbourne,5.0,30/4/2021,321533.32,5814847.52,14/8/2021
1588691,21,"-37.79594883433451, 144.97417678376686","Station Street between Palmerston Street and Kay Street approximately 5m East of 69 Station Street, Carlton, 3053",,,,-37.79594883,144.97417678376686,,,0,Bicycle Rails,1,1,,,,,,1588691,Bicycle Rails - Galvanised Steel Bicycle Rail,Outdoor Furniture,Bicycle Rails,200101-002,Bicycle Rails - Galvanised Steel Bicycle Rail,Infrastructure and Assets,City of Melbourne,2.5,30/4/2021,321637.1,5814891.58,14/8/2021
1473552,21,"-37.79744175658628, 144.97114742680589","Elgin Street between Canning Street and Rathdowne Street approximately 6m SW of CommandFix, 106 Elgin Street, Carlton, 3053",,,,-37.79744176,144.97114742680589,,,0,Bicycle Rails,1,1,,,,,,1473552,Bicycle Rails - Stainless Steel Bicycle Hoop,Outdoor Furniture,Bicycle Rails,200101-004,Bicycle Rails - Stainless Steel Bicycle Hoop,Infrastructure and Assets,City of Melbourne,2.92,30/4/2021,321373.95,5814720.13,14/8/2021
1770423,21,"-37.80490459013851, 144.9615506650101","Bouverie Street between Victoria Street and Queensberry Street approximately 3m East of Bouverie Dental, 69 Bouverie Street, Carlton, 3053",,,,-37.80490459,144.9615506650101,,,0,Bicycle Rails,1,1,,,,,,1770423,Bicycle Rails - Stainless Steel Bicycle Hoop,Outdoor Furniture,Bicycle Rails,200101-004,Bicycle Rails - Stainless Steel Bicycle Hoop,Infrastructure and Assets,City of Melbourne,4.59,30/4/2021,320547.0,5813873.62,14/8/2021
1740982,21,"-37.798198510289915, 144.9687550340712","Drummond Street between Faraday Street and Elgin Street approximately 22m South of Raw Element, Shop, 333 Drummond Street, Carlton, 3053",,,,-37.79819851,144.9687550340712,,,0,Bicycle Rails,1,1,,,,,,1740982,Bicycle Rails - Stainless Steel Bicycle Hoop,Outdoor Furniture,Bicycle Rails,200101-004,Bicycle Rails - Stainless Steel Bicycle Hoop,Infrastructure and Assets,City of Melbourne,3.89,30/4/2021,321165.12,5814631.58,14/8/2021
1588692,21,"-37.7959521016796, 144.97419384310257","Station Street between Palmerston Street and Kay Street approximately 7m East of 69 Station Street, Carlton, 3053",,,,-37.7959521,144.97419384310257,,,0,Bicycle Rails,1,1,,,,,,1588692,Bicycle Rails - Galvanised Steel Bicycle Rail,Outdoor Furniture,Bicycle Rails,200101-002,Bicycle Rails - Galvanised Steel Bicycle Rail,Infrastructure and Assets,City of Melbourne,2.5,30/4/2021,321638.61,5814891.25,14/8/2021
1074265,21,"-37.806738942449286, 144.964708265963","Victoria Street between Lygon Street and Cardigan Street approximately 10m West of Royal Melbourne Institute Of Technology, 80-92 Victoria Street, Carlton, 3053",,,,-37.80673894,144.9647083,,,0,Bicycle Rails,1,1,,,,,,1074265,Bicycle Rails - Stainless Steel Bicycle Hoop,Outdoor Furniture,Bicycle Rails,200101-004,Bicycle Rails - Stainless Steel Bicycle Hoop,Infrastructure and Assets,City of Melbourne,3.15,30/4/2021,320829.44,5813676.13,14/8/2021
