id,map_id,address,description,pic,link,icon,lat,lng,anim,title,infoopen,category,approved,retina,type,did,sticky,other_data,layergroup,Custom Field: GIS_ID,Custom Field: DESCRIPTION_BIKE,Custom Field: ASSET_CLASS,Custom Field: ASSET_TYPE,Custom Field: MODEL_NO,Custom Field: MODEL_DESCR,Custom Field: DIVISION,Custom Field: COMPANY,Custom Field: CONDITION_RATING,Custom Field: EVALUATION_DATE,Custom Field: EASTING,Custom Field: NORTHING,Custom Field: UploadDate
1772397,21,"-37.804772395628454, 144.94768288427656","Curzon Street between Victoria Street and Elm Street approximately 27m West of Brown Gouge Valet, 2-4 Curzon Street, North Melbourne, 3051",,,,-37.8047724,144.94768288427656,,,0,Bicycle Rails,1,1,,,,,,1772397,Bicycle Rails - Stainless Steel Bicycle Hoop,Outdoor Furniture,Bicycle Rails,200101-004,Bicycle Rails - Stainless Steel Bicycle Hoop,Infrastructure and Assets,City of Melbourne,4.59,30/4/2021,319325.71,5813861.56,14/8/2021
1507356,21,"-37.80472297359755, 144.95370830256584","Howard Street between Victoria Street and Queensberry Street approximately 5m SE of Lingua Italia, Studio 9, Ground, 101 Howard Street, North Melbourne, 3051",,,,-37.80472297,144.95370830256584,,,0,Bicycle Rails,1,1,,,,,,1507356,Bicycle Rails - Stainless Steel Bicycle Hoop,Outdoor Furniture,Bicycle Rails,200101-004,Bicycle Rails - Stainless Steel Bicycle Hoop,Infrastructure and Assets,City of Melbourne,2.44,30/4/2021,319856.09,5813878.68,14/8/2021
1569880,21,"-37.80207107547571, 144.9472406681361","Provost Street between Curzon Street and Abbotsford Street approximately 4m NE of 17 Provost Street, North Melbourne, 3051",,,,-37.80207108,144.9472406681361,,,0,Bicycle Rails,1,1,,,,,,1569880,Bicycle Rails - Galvanised Steel Bicycle Rail,Outdoor Furniture,Bicycle Rails,200101-002,Bicycle Rails - Galvanised Steel Bicycle Rail,Infrastructure and Assets,City of Melbourne,2.25,30/4/2021,319280.19,5814160.46,14/8/2021
1617539,21,"-37.80451344394413, 144.95402949689546","Howard Street between Victoria Street and Queensberry Street approximately 8m North of North Melbourne Children's Centre, 28 Howard Street, North Melbourne, 3051",,,,-37.80451344,144.95402949689546,,,0,Bicycle Rails,1,1,,,,,,1617539,Bicycle Rails - Stainless Steel Bicycle Hoop,Outdoor Furniture,Bicycle Rails,200101-004,Bicycle Rails - Stainless Steel Bicycle Hoop,Infrastructure and Assets,City of Melbourne,2.44,30/4/2021,319883.86,5813902.55,14/8/2021
1566043,21,"-37.804866237940104, 144.957937936247","O'Connell Street between Victoria Street and Queensberry Street approximately 15m NE of Animals Australia Federation, 37 O'Connell Street, North Melbourne, 3051",,,,-37.80486624,144.9579379,,,0,Bicycle Rails,1,1,,,,,,1566043,Bicycle Rails - Galvanised Steel Bicycle Rail,Outdoor Furniture,Bicycle Rails,200101-002,Bicycle Rails - Galvanised Steel Bicycle Rail,Infrastructure and Assets,City of Melbourne,2.2,30/4/2021,320228.83,5813870.93,14/8/2021
1647832,21,"-37.798083208402375, 144.9511640622551","Murphy Street between Flemington Road and Errol Street approximately 23m East of 2 Chapman Street, North Melbourne, 3051",,,,-37.79808321,144.9511640622551,,,0,Bicycle Rails,1,1,,,,,,1647832,Bicycle Rails - Stainless Steel Bicycle Hoop,Outdoor Furniture,Bicycle Rails,200101-004,Bicycle Rails - Stainless Steel Bicycle Hoop,Infrastructure and Assets,City of Melbourne,3.13,30/4/2021,319615.93,5814610.56,14/8/2021
1631462,21,"-37.795012285725825, 144.9453768060837","Erskine Street between Abbotsford Street and Dryburgh Street approximately 26m South of 22A Erskine Street, North Melbourne, 3051",,,,-37.79501229,144.9453768060837,,,0,Bicycle Rails,1,1,,,,,,1631462,Bicycle Rails - Stainless Steel Bicycle Hoop,Outdoor Furniture,Bicycle Rails,200101-004,Bicycle Rails - Stainless Steel Bicycle Hoop,Infrastructure and Assets,City of Melbourne,2.43,30/4/2021,319098.86,5814940.14,14/8/2021
1618909,21,"-37.79466642891822, 144.9423426368769","Erskine Street between Dryburgh Street and Melrose Street approximately 5m North of 63 Erskine Street, North Melbourne, 3051",,,,-37.79466643,144.9423426368769,,,0,Bicycle Rails,1,1,,,,,,1618909,Bicycle Rails - Stainless Steel Bicycle Hoop,Outdoor Furniture,Bicycle Rails,200101-004,Bicycle Rails - Stainless Steel Bicycle Hoop,Infrastructure and Assets,City of Melbourne,2.41,30/4/2021,318830.84,5814972.64,14/8/2021
1758345,21,"-37.79269129219998, 144.9420520981405","Melrose Street between Brougham Street and Sutton Street approximately 3m NE of Hotham Hub Children's Centre, Hotham Hub Childrens Centre, 113 Melrose Street, North Melbourne, 3051",,,,-37.79269129,144.9420520981405,,,0,Bicycle Rails,1,1,,,,,,1758345,Bicycle Rails - Stainless Steel Bicycle Hoop,Outdoor Furniture,Bicycle Rails,200101-004,Bicycle Rails - Stainless Steel Bicycle Hoop,Infrastructure and Assets,City of Melbourne,4.59,30/4/2021,318800.43,5815191.25,14/8/2021
1656124,21,"-37.799356001194234, 144.95504575306413","Flemington Road between Wreckyn Street and Villiers Street approximately 74m East of 61-63 Flemington Road, North Melbourne, 3051",,,,-37.799356,144.95504575306413,,,0,Bicycle Rails,1,1,,,,,,1656124,Bicycle Rails - Stainless Steel Bicycle Hoop,Outdoor Furniture,Bicycle Rails,200101-004,Bicycle Rails - Stainless Steel Bicycle Hoop,Infrastructure and Assets,City of Melbourne,3.0,30/4/2021,319960.81,5814476.81,14/8/2021
1755817,21,"-37.80554496724985, 144.95623721440006","Peel Street between Victoria Street and Princess Street approximately 8m SW of Ground, 110 Peel Street, North Melbourne, 3051",,,,-37.80554497,144.95623721440006,,,0,Bicycle Rails,1,1,,,,,,1755817,Bicycle Rails - Stainless Steel Bicycle Hoop,Outdoor Furniture,Bicycle Rails,200101-004,Bicycle Rails - Stainless Steel Bicycle Hoop,Infrastructure and Assets,City of Melbourne,4.59,30/4/2021,320080.74,5813792.34,14/8/2021
1545398,21,"-37.80584709653675, 144.9566713989393","Victoria Street between Cobden Street and Peel Street approximately 3m SE of Curry Corner, 292 Victoria Street, North Melbourne, 3051",,,,-37.8058471,144.9566713989393,,,0,Bicycle Rails,1,1,,,,,,1545398,Bicycle Rails - Stainless Steel Bicycle Hoop,Outdoor Furniture,Bicycle Rails,200101-004,Bicycle Rails - Stainless Steel Bicycle Hoop,Infrastructure and Assets,City of Melbourne,3.16,30/4/2021,320119.7,5813759.65,14/8/2021
1551664,21,"-37.79541815533871, 144.94012405989352","Buncle Street between Macaulay Road and Caytre Crescent approximately 16m East of 1 Buncle Street, North Melbourne, 3051",,,,-37.79541816,144.94012405989352,,,0,Bicycle Rails,1,1,,,,,,1551664,Bicycle Rails - Galvanised Steel Bicycle Rail,Outdoor Furniture,Bicycle Rails,200101-002,Bicycle Rails - Galvanised Steel Bicycle Rail,Infrastructure and Assets,City of Melbourne,2.23,30/4/2021,318637.32,5814884.92,14/8/2021
1551707,21,"-37.794914746492246, 144.9399739422541","Caytre Crescent between Buncle Street and Pampas Street approximately 10m SW of 9 Buncle Street, North Melbourne, 3051",,,,-37.79491475,144.9399739422541,,,0,Bicycle Rails,1,1,,,,,,1551707,Bicycle Rails - Galvanised Steel Bicycle Rail,Outdoor Furniture,Bicycle Rails,200101-002,Bicycle Rails - Galvanised Steel Bicycle Rail,Infrastructure and Assets,City of Melbourne,2.23,30/4/2021,318622.87,5814940.49,14/8/2021
1752597,21,"-37.80375782311833, 144.9569370617864","Queensberry Street between Cobden Street and Peel Street approximately 3m South of Northside Cycles, Ground, 334-336 Queensberry Street, North Melbourne, 3051",,,,-37.80375782,144.9569370617864,,,0,Bicycle Rails,1,1,,,,,,1752597,Bicycle Rails - Stainless Steel Bicycle Hoop,Outdoor Furniture,Bicycle Rails,200101-004,Bicycle Rails - Stainless Steel Bicycle Hoop,Infrastructure and Assets,City of Melbourne,4.18,30/4/2021,320138.02,5813992.0,14/8/2021
1499429,21,"-37.80104229348687, 144.95298716073992","Intersection of Arden Street and Courtney Street approximately 5m South of Edinburgh Castle Hotel, 56-58 Courtney Street, North Melbourne, 3051",,,,-37.80104229,144.95298716073992,,,0,Bicycle Rails,1,1,,,,,,1499429,Bicycle Rails - Painted Steel Bicycle Rail,Outdoor Furniture,Bicycle Rails,200101-003,Bicycle Rails - Painted Steel Bicycle Rail,Infrastructure and Assets,City of Melbourne,2.12,30/4/2021,319783.65,5814285.72,14/8/2021
1565471,21,"-37.80328041622907, 144.94970600425316","Errol Street between Victoria Street and Queensberry Street approximately 10m North of Australian Postal Corporation, Ground, 72-82 Errol Street, North Melbourne, 3051",,,,-37.80328042,144.94970600425316,,,0,Bicycle Rails,1,1,,,,,,1565471,Bicycle Rails - Stainless Steel Bicycle Hoop,Outdoor Furniture,Bicycle Rails,200101-004,Bicycle Rails - Stainless Steel Bicycle Hoop,Infrastructure and Assets,City of Melbourne,3.14,30/4/2021,319500.2,5814031.03,14/8/2021
1584872,21,"-37.80244176901436, 144.94987605171528","Errol Street between Queensberry Street and Arden Street approximately 3m West of 106B Errol Street, North Melbourne, 3051",,,,-37.80244177,144.94987605171528,,,0,Bicycle Rails,1,1,,,,,,1584872,Bicycle Rails - Stainless Steel Bicycle Hoop,Outdoor Furniture,Bicycle Rails,200101-004,Bicycle Rails - Stainless Steel Bicycle Hoop,Infrastructure and Assets,City of Melbourne,3.04,30/4/2021,319513.13,5814124.42,14/8/2021
1739323,21,"-37.80226574924751, 144.94955915806628","Purcell Street between Curzon Street and Errol Street approximately 6m SW of 113A Errol Street, North Melbourne, 3051",,,,-37.80226575,144.94955915806628,,,0,Bicycle Rails,1,1,,,,,,1739323,Bicycle Rails - Stainless Steel Bicycle Hoop,Outdoor Furniture,Bicycle Rails,200101-004,Bicycle Rails - Stainless Steel Bicycle Hoop,Infrastructure and Assets,City of Melbourne,3.04,30/4/2021,319484.8,5814143.34,14/8/2021
1533043,21,"-37.80325764101538, 144.95021989141938","Queensberry Street between Leveson Street and Errol Street approximately 12m East of Arts House North Melbourne Townhall, Arts House, North Melbourne Town Hall, 521 Queensberry Street, North Melbourne, 3051",,,,-37.80325764,144.95021989141938,,,0,Bicycle Rails,1,1,,,,,,1533043,Bicycle Rails - Stainless Steel Bicycle Hoop,Outdoor Furniture,Bicycle Rails,200101-004,Bicycle Rails - Stainless Steel Bicycle Hoop,Infrastructure and Assets,City of Melbourne,3.14,30/4/2021,319545.39,5814034.55,14/8/2021
1074946,21,"-37.80147353588785, 144.95465888938688","Blackwood Street between Flemington Road and Courtney Street approximately 19m SW of Port Phillip Sea Pilots Pty Ltd, 9-11 Blackwood Street, North Melbourne, 3051",,,,-37.80147354,144.95465888938688,,,0,Bicycle Rails,1,1,,,,,,1074946,Bicycle Rails - Stainless Steel Bicycle Hoop,Outdoor Furniture,Bicycle Rails,200101-004,Bicycle Rails - Stainless Steel Bicycle Hoop,Infrastructure and Assets,City of Melbourne,3.12,30/4/2021,319931.89,5814241.09,14/8/2021
1551665,21,"-37.79542904234943, 144.94012307608634","Buncle Street between Macaulay Road and Caytre Crescent approximately 16m East of 1 Buncle Street, North Melbourne, 3051",,,,-37.79542904,144.94012307608634,,,0,Bicycle Rails,1,1,,,,,,1551665,Bicycle Rails - Galvanised Steel Bicycle Rail,Outdoor Furniture,Bicycle Rails,200101-002,Bicycle Rails - Galvanised Steel Bicycle Rail,Infrastructure and Assets,City of Melbourne,2.23,30/4/2021,318637.26,5814883.71,14/8/2021
1584047,21,"-37.79932303938344, 144.94058798123478","North Melbourne Recreation Reserve approximately 84m North of Champion Parts, 205-213 Arden Street, North Melbourne, 3051",,,,-37.79932304,144.94058798123478,,,0,Bicycle Rails,1,1,,,,,,1584047,Bicycle Rails - Stainless Steel Bicycle Hoop - North Melbourne Recreation Reserve,Outdoor Furniture,Bicycle Rails,200101-004,Bicycle Rails - Stainless Steel Bicycle Hoop,Parks and City Greening,City of Melbourne,4.0,9/4/2019,318687.72,5814452.51,14/8/2021
1551669,21,"-37.79511281988964, 144.94003033283514","Buncle Street between Macaulay Road and Caytre Crescent approximately 3m East of 7 Buncle Street, North Melbourne, 3051",,,,-37.79511282,144.94003033283514,,,0,Bicycle Rails,1,1,,,,,,1551669,Bicycle Rails - Galvanised Steel Bicycle Rail,Outdoor Furniture,Bicycle Rails,200101-002,Bicycle Rails - Galvanised Steel Bicycle Rail,Infrastructure and Assets,City of Melbourne,2.23,30/4/2021,318628.32,5814918.62,14/8/2021
1074675,21,"-37.8000258634772, 144.95001906187935","Errol Street between O'Shanassy Street and Haines Street approximately 3m NE of 193 Errol Street, North Melbourne, 3051",,,,-37.80002586,144.95001906187937,,,0,Bicycle Rails,1,1,,,,,,1074675,Bicycle Rails - Stainless Steel Bicycle Hoop,Outdoor Furniture,Bicycle Rails,200101-004,Bicycle Rails - Stainless Steel Bicycle Hoop,Infrastructure and Assets,City of Melbourne,3.13,30/4/2021,319519.84,5814392.78,14/8/2021
1551706,21,"-37.79490724455912, 144.93997267431044","Caytre Crescent between Buncle Street and Pampas Street approximately 10m SW of 9 Buncle Street, North Melbourne, 3051",,,,-37.79490724,144.93997267431044,,,0,Bicycle Rails,1,1,,,,,,1551706,Bicycle Rails - Galvanised Steel Bicycle Rail,Outdoor Furniture,Bicycle Rails,200101-002,Bicycle Rails - Galvanised Steel Bicycle Rail,Infrastructure and Assets,City of Melbourne,2.23,30/4/2021,318622.74,5814941.32,14/8/2021
1313542,21,"-37.80523526896712, 144.95119334130789","Victoria Street between Chetwynd Street and Leveson Street approximately 4m SE of North Melbourne Family Medical Centre, Ground, 452 Victoria Street, North Melbourne, 3051",,,,-37.80523527,144.95119334130789,,,0,Bicycle Rails,1,1,,,,,,1313542,Bicycle Rails - Stainless Steel Bicycle Hoop,Outdoor Furniture,Bicycle Rails,200101-004,Bicycle Rails - Stainless Steel Bicycle Hoop,Infrastructure and Assets,City of Melbourne,3.03,30/4/2021,319635.91,5813816.98,14/8/2021
1551674,21,"-37.79435001757556, 144.94006367326713","Caytre Crescent between Buncle Street and Pampas Street approximately 5m SE of 49 Caytre Crescent, North Melbourne, 3051",,,,-37.79435002,144.94006367326713,,,0,Bicycle Rails,1,1,,,,,,1551674,Bicycle Rails - Galvanised Steel Bicycle Rail,Outdoor Furniture,Bicycle Rails,200101-002,Bicycle Rails - Galvanised Steel Bicycle Rail,Infrastructure and Assets,City of Melbourne,2.23,30/4/2021,318629.39,5815003.33,14/8/2021
1617581,21,"-37.79979051985862, 144.9468350962314","O'Shanassy Street between Curzon Street and Abbotsford Street approximately 46m NE of 103 O'Shanassy Street, North Melbourne, 3051",,,,-37.79979052,144.9468350962314,,,0,Bicycle Rails,1,1,,,,,,1617581,Bicycle Rails - Stainless Steel Bicycle Hoop,Outdoor Furniture,Bicycle Rails,200101-004,Bicycle Rails - Stainless Steel Bicycle Hoop,Infrastructure and Assets,City of Melbourne,2.83,30/4/2021,319238.92,5814412.74,14/8/2021
1519383,21,"-37.801964822049364, 144.94510123400065","Little Lothian Street North from Lothian Street approximately 11m NE of 7 Little Lothian Street North, North Melbourne, 3051",,,,-37.80196482,144.94510123400065,,,0,Bicycle Rails,1,1,,,,,,1519383,Bicycle Rails - Galvanised Steel Bicycle Rail,Outdoor Furniture,Bicycle Rails,200101-002,Bicycle Rails - Galvanised Steel Bicycle Rail,Infrastructure and Assets,City of Melbourne,2.25,30/4/2021,319091.56,5814168.11,14/8/2021
1777901,21,"-37.80063206212403, 144.95672756534825","Flemington Road between Elizabeth Street and Blackwood Street approximately 69m North of 1 Flemington Road, North Melbourne, 3051",,,,-37.80063206,144.95672756534825,,,0,Bicycle Rails,1,1,,,,,,1777901,Bicycle Rails - Stainless Steel Bicycle Hoop,Outdoor Furniture,Bicycle Rails,200101-004,Bicycle Rails - Stainless Steel Bicycle Hoop,Infrastructure and Assets,City of Melbourne,4.59,30/4/2021,320111.99,5814338.45,14/8/2021
1507371,21,"-37.79194891870727, 144.93786961104254","Sutton Street between Boundary Road and Western Link Road approximately 62m NW of Dann Event Hire Pty Ltd, 77 Sutton Street, North Melbourne, 3051",,,,-37.79194892,144.93786961104254,,,0,Bicycle Rails,1,1,,,,,,1507371,Bicycle Rails - Stainless Steel Bicycle Hoop,Outdoor Furniture,Bicycle Rails,200101-004,Bicycle Rails - Stainless Steel Bicycle Hoop,Infrastructure and Assets,City of Melbourne,3.03,30/4/2021,318430.31,5815265.51,14/8/2021
1639806,21,"-37.80588579863948, 144.95696984728255","Victoria Street between Cobden Street and Peel Street approximately 9m SE of 284 Victoria Street, North Melbourne, 3051",,,,-37.8058858,144.95696984728255,,,0,Bicycle Rails,1,1,,,,,,1639806,Bicycle Rails - Stainless Steel Bicycle Hoop,Outdoor Furniture,Bicycle Rails,200101-004,Bicycle Rails - Stainless Steel Bicycle Hoop,Infrastructure and Assets,City of Melbourne,3.16,30/4/2021,320146.07,5813755.93,14/8/2021
1073900,21,"-37.80340546430164, 144.94968846224953","Errol Street between Victoria Street and Queensberry Street approximately 7m SW of Australian Postal Corporation, Ground, 72-82 Errol Street, North Melbourne, 3051",,,,-37.80340546,144.94968846224953,,,0,Bicycle Rails,1,1,,,,,,1073900,Bicycle Rails - Stainless Steel Bicycle Hoop,Outdoor Furniture,Bicycle Rails,200101-004,Bicycle Rails - Stainless Steel Bicycle Hoop,Infrastructure and Assets,City of Melbourne,3.14,30/4/2021,319498.96,5814017.12,14/8/2021
1752598,21,"-37.803752295032005, 144.9568573684433","Queensberry Street between Cobden Street and Peel Street approximately 5m SE of Space 338, 338 Queensberry Street, North Melbourne, 3051",,,,-37.8037523,144.9568573684433,,,0,Bicycle Rails,1,1,,,,,,1752598,Bicycle Rails - Stainless Steel Bicycle Hoop,Outdoor Furniture,Bicycle Rails,200101-004,Bicycle Rails - Stainless Steel Bicycle Hoop,Infrastructure and Assets,City of Melbourne,4.18,30/4/2021,320130.99,5813992.46,14/8/2021
1618231,21,"-37.80055321155416, 144.9557463046443","Flemington Road between Blackwood Street and Wreckyn Street approximately 12m SE of Domino's Pizza, 23 Flemington Road, North Melbourne, 3051",,,,-37.80055321,144.9557463046443,,,0,Bicycle Rails,1,1,,,,,,1618231,Bicycle Rails - Stainless Steel Bicycle Hoop,Outdoor Furniture,Bicycle Rails,200101-004,Bicycle Rails - Stainless Steel Bicycle Hoop,Infrastructure and Assets,City of Melbourne,3.0,30/4/2021,320025.4,5814345.31,14/8/2021
1643468,21,"-37.80258632758138, 144.95110379252242","Leveson Street between Queensberry Street and Arden Street approximately 6m East of 75A Leveson Street, North Melbourne, 3051",,,,-37.80258633,144.95110379252242,,,0,Bicycle Rails,1,1,,,,,,1643468,Bicycle Rails - Stainless Steel Bicycle Hoop,Outdoor Furniture,Bicycle Rails,200101-004,Bicycle Rails - Stainless Steel Bicycle Hoop,Infrastructure and Assets,City of Melbourne,2.24,30/4/2021,319621.58,5814110.75,14/8/2021
1755837,21,"-37.801800690012776, 144.95394456031687","Courtney Street between Blackwood Street and Wreckyn Street approximately 5m South of Metropolitan Hotel, Metropolitan Hotel, 42 Courtney Street, North Melbourne, 3051",,,,-37.80180069,144.95394456031687,,,0,Bicycle Rails,1,1,,,,,,1755837,Bicycle Rails - Stainless Steel Bicycle Hoop,Outdoor Furniture,Bicycle Rails,200101-004,Bicycle Rails - Stainless Steel Bicycle Hoop,Infrastructure and Assets,City of Melbourne,4.59,30/4/2021,319869.79,5814203.41,14/8/2021
1074785,21,"-37.80444460621091, 144.94926389819688","Errol Street between Victoria Street and Queensberry Street approximately 6m SE of North Melbourne Lotto, Ground, 25 Errol Street, North Melbourne, 3051",,,,-37.80444461,144.94926389819688,,,0,Bicycle Rails,1,1,,,,,,1074785,Bicycle Rails - Stainless Steel Bicycle Hoop,Outdoor Furniture,Bicycle Rails,200101-004,Bicycle Rails - Stainless Steel Bicycle Hoop,Infrastructure and Assets,City of Melbourne,3.14,30/4/2021,319464.11,5813900.99,14/8/2021
1545559,21,"-37.80175344169586, 144.95469523471223","Blackwood Street between Flemington Road and Courtney Street approximately 10m NE of BMDI Rotary House, 4-12 Blackwood Street, North Melbourne, 3051",,,,-37.80175344,144.95469523471223,,,0,Bicycle Rails,1,1,,,,,,1545559,Bicycle Rails - Stainless Steel Bicycle Hoop,Outdoor Furniture,Bicycle Rails,200101-004,Bicycle Rails - Stainless Steel Bicycle Hoop,Infrastructure and Assets,City of Melbourne,3.12,30/4/2021,319935.77,5814210.1,14/8/2021
1644028,21,"-37.80221427657655, 144.9486268732639","Purcell Street between Curzon Street and Errol Street approximately 8m South of 28 Purcell Street, North Melbourne, 3051",,,,-37.80221428,144.9486268732639,,,0,Bicycle Rails,1,1,,,,,,1644028,Bicycle Rails - Stainless Steel Bicycle Hoop,Outdoor Furniture,Bicycle Rails,200101-004,Bicycle Rails - Stainless Steel Bicycle Hoop,Infrastructure and Assets,City of Melbourne,3.25,30/4/2021,319402.59,5814147.25,14/8/2021
1074591,21,"-37.796427603951415, 144.94230183094112","Shiel Street between Dryburgh Street and Canning Street approximately 25m SW of 58B Shiel Street, North Melbourne, 3051",,,,-37.7964276,144.94230183094112,,,0,Bicycle Rails,1,1,,,,,,1074591,Bicycle Rails - Stainless Steel Bicycle Hoop,Outdoor Furniture,Bicycle Rails,200101-004,Bicycle Rails - Stainless Steel Bicycle Hoop,Infrastructure and Assets,City of Melbourne,2.82,30/4/2021,318831.55,5814777.13,14/8/2021
1074065,21,"-37.79986636711208, 144.9431976589807","North Melbourne Recreation Centre Aquatic Centre approximately 33m West of North Melbourne Recreation Centre, Aquatic Centre, 1 Macaulay Road, North Melbourne, 3051",,,,-37.79986637,144.9431976589807,,,0,Bicycle Rails,1,1,,,,,,1074065,Bicycle Rails - Stainless Steel Bicycle Hoop,Outdoor Furniture,Bicycle Rails,200101-004,Bicycle Rails - Stainless Steel Bicycle Hoop,Infrastructure and Assets,City of Melbourne,1.17,30/4/2021,318918.83,5814397.28,14/8/2021
1643471,21,"-37.80162892274959, 144.9512646106316","Leveson Street between Queensberry Street and Arden Street approximately 5m East of 113 Leveson Street, North Melbourne, 3051",,,,-37.80162892,144.9512646106316,,,0,Bicycle Rails,1,1,,,,,,1643471,Bicycle Rails - Stainless Steel Bicycle Hoop,Outdoor Furniture,Bicycle Rails,200101-004,Bicycle Rails - Stainless Steel Bicycle Hoop,Infrastructure and Assets,City of Melbourne,2.24,30/4/2021,319633.41,5814217.3,14/8/2021
1584044,21,"-37.799431914207, 144.94065571230794","North Melbourne Recreation Reserve approximately 72m North of Champion Parts, 205-213 Arden Street, North Melbourne, 3051",,,,-37.79943191,144.94065571230794,,,0,Bicycle Rails,1,1,,,,,,1584044,Bicycle Rails - Stainless Steel Bicycle Hoop - North Melbourne Recreation Reserve,Outdoor Furniture,Bicycle Rails,200101-004,Bicycle Rails - Stainless Steel Bicycle Hoop,Parks and City Greening,City of Melbourne,4.0,9/4/2019,318693.95,5814440.56,14/8/2021
1755832,21,"-37.80229465024694, 144.95573622240804","Bedford Street between Courtney Street and Peel Street approximately 27m SW of Campus Services, 21 Bedford Street, North Melbourne, 3051",,,,-37.80229465,144.95573622240804,,,0,Bicycle Rails,1,1,,,,,,1755832,Bicycle Rails - Stainless Steel Bicycle Hoop,Outdoor Furniture,Bicycle Rails,200101-004,Bicycle Rails - Stainless Steel Bicycle Hoop,Infrastructure and Assets,City of Melbourne,4.59,30/4/2021,320028.74,5814152.05,14/8/2021
1551680,21,"-37.794426924751505, 144.93983395492322","Caytre Crescent between Buncle Street and Pampas Street approximately 4m NE of 16 Caytre Crescent, North Melbourne, 3051",,,,-37.79442692,144.93983395492322,,,0,Bicycle Rails,1,1,,,,,,1551680,Bicycle Rails - Galvanised Steel Bicycle Rail,Outdoor Furniture,Bicycle Rails,200101-002,Bicycle Rails - Galvanised Steel Bicycle Rail,Infrastructure and Assets,City of Melbourne,2.23,30/4/2021,318609.35,5814994.35,14/8/2021
1391406,21,"-37.80445138586886, 144.95642910110908","Peel Street between Princess Street and Queensberry Street approximately 9m SW of RSA Course Melbourne, 154 Peel Street, North Melbourne, 3051",,,,-37.80445139,144.95642910110908,,,0,Bicycle Rails,1,1,,,,,,1391406,Bicycle Rails - Stainless Steel Bicycle Hoop,Outdoor Furniture,Bicycle Rails,200101-004,Bicycle Rails - Stainless Steel Bicycle Hoop,Infrastructure and Assets,City of Melbourne,3.17,30/4/2021,320094.98,5813914.06,14/8/2021
1569122,21,"-37.79024420714431, 144.94267438555792","Buncle Street between Alfred Street and Flemington Road approximately 31m North of 189 Melrose Street, North Melbourne, 3051",,,,-37.79024421,144.94267438555792,,,0,Bicycle Rails,1,1,,,,,,1569122,Bicycle Rails - Stainless Steel Bicycle Hoop,Outdoor Furniture,Bicycle Rails,200101-004,Bicycle Rails - Stainless Steel Bicycle Hoop,Infrastructure and Assets,City of Melbourne,2.23,30/4/2021,318849.25,5815464.0,14/8/2021
1755821,21,"-37.80575460530395, 144.95817629209415","O'Connell Street between Victoria Street and Queensberry Street approximately 4m North of Braised Ducky Lee, Unit 30, Ground, 1 O'Connell Street, North Melbourne, 3051",,,,-37.80575461,144.95817629209415,,,0,Bicycle Rails,1,1,,,,,,1755821,Bicycle Rails - Stainless Steel Bicycle Hoop,Outdoor Furniture,Bicycle Rails,200101-004,Bicycle Rails - Stainless Steel Bicycle Hoop,Infrastructure and Assets,City of Melbourne,4.59,30/4/2021,320251.97,5813772.81,14/8/2021
1507358,21,"-37.79983721290697, 144.9473010397974","O'Shanassy Street between Curzon Street and Abbotsford Street approximately 84m East of 103 O'Shanassy Street, North Melbourne, 3051",,,,-37.79983721,144.9473010397974,,,0,Bicycle Rails,1,1,,,,,,1507358,Bicycle Rails - Stainless Steel Bicycle Hoop,Outdoor Furniture,Bicycle Rails,200101-004,Bicycle Rails - Stainless Steel Bicycle Hoop,Infrastructure and Assets,City of Melbourne,2.83,30/4/2021,319280.06,5814408.46,14/8/2021
1618906,21,"-37.794700584019644, 144.94264183981153","Erskine Street between Dryburgh Street and Melrose Street approximately 6m North of 59 Erskine Street, North Melbourne, 3051",,,,-37.79470058,144.94264183981153,,,0,Bicycle Rails,1,1,,,,,,1618906,Bicycle Rails - Stainless Steel Bicycle Hoop,Outdoor Furniture,Bicycle Rails,200101-004,Bicycle Rails - Stainless Steel Bicycle Hoop,Infrastructure and Assets,City of Melbourne,2.41,30/4/2021,318857.27,5814969.43,14/8/2021
